{
  "schema_version": "AMP_H5_PHASE_SPLIT_READOUT_V4",
  "base_directory": "..",
  "methods": {
    "CE21_DDPM": {
      "training_source_root": "runs/formal_v2/categorical_ce",
      "generation_attempt_root": "runs/ce_checkpoint_recovery_v1",
      "training_instance_id": "formal_v2/categorical_ce",
      "generation_attempt_id": "ce_checkpoint_recovery_v1"
    },
    "MSE21_DDPM": {
      "training_source_root": "runs/formal_v2/raw_onehot_mse",
      "generation_attempt_root": "runs/formal_v2/raw_onehot_mse",
      "training_instance_id": "formal_v2/raw_onehot_mse",
      "generation_attempt_id": "formal_v2/raw_onehot_mse"
    },
    "scalar_DDPM": {
      "training_source_root": "runs/formal_v2/scalar_legacy",
      "generation_attempt_root": "runs/formal_v2/scalar_legacy",
      "training_instance_id": "formal_v2/scalar_legacy",
      "generation_attempt_id": "formal_v2/scalar_legacy"
    },
    "terminal_LSTM": {
      "training_source_root": "runs/formal_v1/terminal_lstm",
      "generation_attempt_root": "runs/formal_v1/terminal_lstm",
      "training_instance_id": "formal_v1/terminal_lstm",
      "generation_attempt_id": "formal_v1/terminal_lstm"
    }
  },
  "evaluation_directories": [
    "feasibility/ce_recovery_ar_partial_evaluation_v1"
  ],
  "recovery_postflight_receipt": {
    "path": "review/independent/CE_CHECKPOINT_RECOVERY_POSTFLIGHT_v1.json",
    "bytes": 14870,
    "sha256": "2450c62a2553d854685fee7dde300a2ee794746ad8af36bc4db814b9a472c484"
  },
  "context_evidence": [
    {
      "path": "protocol/CE_CHECKPOINT_RECOVERY_AMENDMENT_v1.zh.md",
      "sha256": "e4a02fff5ba2fa73f020fbbc3db52675062801c357b7e471d7ec7c2789125a06"
    },
    {
      "path": "review/independent/READOUT_V4_INDEPENDENT_REVIEW_v1.json",
      "bytes": 4298,
      "sha256": "fdb6da4032a2b1675a3105d0e99227c4ec41e741d09ccf70fad73e9c70f6a0a0"
    },
    {
      "path": "review/independent/AR_FORMAL_POSTFLIGHT_REVIEW.json",
      "bytes": 5301,
      "sha256": "3e523bc8d7f4c1a3aef8f442b33a1976d601aba8e5c8bed825b9427b8bbf62fb"
    },
    {
      "path": "feasibility/ce_recovery_ar_partial_execution_v1/EVALUATION_COMMAND.json",
      "bytes": 7261,
      "sha256": "e26a2b5ccfc0136d81b989f9b5dc73eec3b3f330afb1ef6022c0055ea86aa34f"
    },
    {
      "path": "feasibility/ce_recovery_ar_partial_execution_v1/EVALUATION_RESULT.json",
      "bytes": 4270,
      "sha256": "932fa01e744f583e3e663dd2a7ba0e7d2fb5f1771503a2d4abfb6ac00f8afe04"
    },
    {
      "path": "feasibility/ce_recovery_author_terminal_readout_v1/RECOVERY_AUTHOR_READOUT.json",
      "bytes": 619723,
      "sha256": "c49b244dc6156d0a1965f74d5b779905f397b144ea99c9c5764da83ff2b2bb69"
    }
  ]
}
